{
  "id": "belgium",
  "visualAssets": null,
  "catalog": {
    "id": "belgium",
    "flag": "🇧🇪",
    "name": "Belgium",
    "iso2": "BE",
    "iso3": "BEL",
    "continent": "Europe",
    "region": "Europe",
    "language": "Dutch / French / German",
    "currency": "EUR",
    "currencyName": "Euro",
    "status": "planned",
    "summary": "Future hub for Belgian multilingual locale, identifiers, VAT, and EU payment context.",
    "identifiers": [
      "national number",
      "VAT"
    ],
    "payments": [
      "IBAN",
      "SEPA"
    ],
    "features": [
      "identity",
      "government",
      "banking"
    ],
    "availableWorkbenches": [],
    "plannedWorkbenches": [
      "Belgian National Number Notes"
    ],
    "completion": 20,
    "coordinates": {
      "x": 50,
      "y": 35
    }
  },
  "hub": null
}
